[
  {
    "id": "vs-lstm-summe-canonical",
    "paper_id": "lstm-dpp",
    "method": "vsLSTM",
    "dataset_id": "summe",
    "dataset": "SumMe",
    "split": "80% SumMe training/validation; 20% test; split IDs not reported",
    "training_regime": "Supervised: human importance/summary labels",
    "setting": "Zhang 2016 canonical",
    "features": "ImageNet GoogLeNet pool5, 1024-D",
    "sampling": "Uniform 2 fps; exact frame-index rule not reported",
    "segmentation": "KTS; about 5-second intervals; boundary artifact/hash and full settings not reported",
    "shot_aggregation": "Mean frame importance within shot",
    "budget": "15% machine duration; rounding not fully specified in paper",
    "solver": "Shot knapsack in released evaluator; paper supplement uses ranking/knapsack wording",
    "reference_aggregation": "Maximum user F1, then mean videos (released evaluator)",
    "metric": "Temporal-overlap F1",
    "value": 37.6,
    "unit": "percent",
    "runs": "5 repeats per setting and testing fold (supplement Section 5.2); fold identities not reported",
    "variance": "Standard deviation 0.8 percentage points",
    "source_url": "https://www.cs.utexas.edu/~grauman/papers/zhang-eccv2016-lstm-summ.pdf",
    "source_location": "Table 3, PDF page 10; protocols Table 2 and supplement Sections 1–3, 5",
    "reproduction": "author-reported",
    "comparability_notes": "No independent rerun. Paper and released dppLSTM decoder differ in description; TVSum evaluator has inherited 0.18 reference-budget discrepancy, so paper scores cannot be declared protocol-identical to later repositories. Protocol evidence: https://www.cs.utexas.edu/~grauman/papers/zhang-eccv2016-lstm-summ-supp.pdf ; https://github.com/kezhang-cs/Video-Summarization-with-LSTM/blob/master/codes/dppLSTM_eval.m",
    "verified_on": "2026-09-08",
    "split_identity": "Not independently verified"
  },
  {
    "id": "vs-lstm-summe-augmented",
    "paper_id": "lstm-dpp",
    "method": "vsLSTM",
    "dataset_id": "summe",
    "dataset": "SumMe",
    "split": "80% SumMe + TVSum + OVP(50) + YouTube(39) training/validation; 20% SumMe test",
    "training_regime": "Supervised: human importance/summary labels",
    "setting": "Zhang 2016 augmented",
    "features": "ImageNet GoogLeNet pool5, 1024-D",
    "sampling": "Uniform 2 fps; exact frame-index rule not reported",
    "segmentation": "KTS; about 5-second intervals; boundary artifact/hash and full settings not reported",
    "shot_aggregation": "Mean frame importance within shot",
    "budget": "15% machine duration; rounding not fully specified in paper",
    "solver": "Shot knapsack in released evaluator; paper supplement uses ranking/knapsack wording",
    "reference_aggregation": "Maximum user F1, then mean videos (released evaluator)",
    "metric": "Temporal-overlap F1",
    "value": 41.6,
    "unit": "percent",
    "runs": "5 repeats per setting and testing fold (supplement Section 5.2); fold identities not reported",
    "variance": "Standard deviation 0.5 percentage points",
    "source_url": "https://www.cs.utexas.edu/~grauman/papers/zhang-eccv2016-lstm-summ.pdf",
    "source_location": "Table 3, PDF page 10; protocols Table 2 and supplement Sections 1–3, 5",
    "reproduction": "author-reported",
    "comparability_notes": "No independent rerun. Paper and released dppLSTM decoder differ in description; TVSum evaluator has inherited 0.18 reference-budget discrepancy, so paper scores cannot be declared protocol-identical to later repositories. Protocol evidence: https://www.cs.utexas.edu/~grauman/papers/zhang-eccv2016-lstm-summ-supp.pdf ; https://github.com/kezhang-cs/Video-Summarization-with-LSTM/blob/master/codes/dppLSTM_eval.m",
    "verified_on": "2026-09-08",
    "split_identity": "Not independently verified"
  },
  {
    "id": "vs-lstm-summe-transfer",
    "paper_id": "lstm-dpp",
    "method": "vsLSTM",
    "dataset_id": "summe",
    "dataset": "SumMe",
    "split": "TVSum + OVP(50) + YouTube(39) training/validation; all SumMe test",
    "training_regime": "Supervised: human importance/summary labels",
    "setting": "Zhang 2016 transfer",
    "features": "ImageNet GoogLeNet pool5, 1024-D",
    "sampling": "Uniform 2 fps; exact frame-index rule not reported",
    "segmentation": "KTS; about 5-second intervals; boundary artifact/hash and full settings not reported",
    "shot_aggregation": "Mean frame importance within shot",
    "budget": "15% machine duration; rounding not fully specified in paper",
    "solver": "Shot knapsack in released evaluator; paper supplement uses ranking/knapsack wording",
    "reference_aggregation": "Maximum user F1, then mean videos (released evaluator)",
    "metric": "Temporal-overlap F1",
    "value": 40.7,
    "unit": "percent",
    "runs": "5 repeats per setting and testing fold (supplement Section 5.2); fold identities not reported",
    "variance": "Standard deviation 0.6 percentage points",
    "source_url": "https://www.cs.utexas.edu/~grauman/papers/zhang-eccv2016-lstm-summ.pdf",
    "source_location": "Table 3, PDF page 10; protocols Table 2 and supplement Sections 1–3, 5",
    "reproduction": "author-reported",
    "comparability_notes": "No independent rerun. Paper and released dppLSTM decoder differ in description; TVSum evaluator has inherited 0.18 reference-budget discrepancy, so paper scores cannot be declared protocol-identical to later repositories. Protocol evidence: https://www.cs.utexas.edu/~grauman/papers/zhang-eccv2016-lstm-summ-supp.pdf ; https://github.com/kezhang-cs/Video-Summarization-with-LSTM/blob/master/codes/dppLSTM_eval.m",
    "verified_on": "2026-09-08",
    "split_identity": "Not independently verified"
  },
  {
    "id": "vs-lstm-tvsum-canonical",
    "paper_id": "lstm-dpp",
    "method": "vsLSTM",
    "dataset_id": "tvsum",
    "dataset": "TVSum",
    "split": "80% TVSum training/validation; 20% test; split IDs not reported",
    "training_regime": "Supervised: human importance/summary labels",
    "setting": "Zhang 2016 canonical",
    "features": "ImageNet GoogLeNet pool5, 1024-D",
    "sampling": "Uniform 2 fps; exact frame-index rule not reported",
    "segmentation": "KTS; about 5-second intervals; boundary artifact/hash and full settings not reported",
    "shot_aggregation": "Mean frame importance within shot",
    "budget": "15% machine duration; rounding not fully specified in paper",
    "solver": "Shot knapsack in released evaluator; paper supplement uses ranking/knapsack wording",
    "reference_aggregation": "Mean user F1, then mean videos (released evaluator)",
    "metric": "Temporal-overlap F1",
    "value": 54.2,
    "unit": "percent",
    "runs": "5 repeats per setting and testing fold (supplement Section 5.2); fold identities not reported",
    "variance": "Standard deviation 0.7 percentage points",
    "source_url": "https://www.cs.utexas.edu/~grauman/papers/zhang-eccv2016-lstm-summ.pdf",
    "source_location": "Table 3, PDF page 10; protocols Table 2 and supplement Sections 1–3, 5",
    "reproduction": "author-reported",
    "comparability_notes": "No independent rerun. Paper and released dppLSTM decoder differ in description; TVSum evaluator has inherited 0.18 reference-budget discrepancy, so paper scores cannot be declared protocol-identical to later repositories. Protocol evidence: https://www.cs.utexas.edu/~grauman/papers/zhang-eccv2016-lstm-summ-supp.pdf ; https://github.com/kezhang-cs/Video-Summarization-with-LSTM/blob/master/codes/dppLSTM_eval.m",
    "verified_on": "2026-09-08",
    "split_identity": "Not independently verified"
  },
  {
    "id": "vs-lstm-tvsum-augmented",
    "paper_id": "lstm-dpp",
    "method": "vsLSTM",
    "dataset_id": "tvsum",
    "dataset": "TVSum",
    "split": "80% TVSum + SumMe + OVP(50) + YouTube(39) training/validation; 20% TVSum test",
    "training_regime": "Supervised: human importance/summary labels",
    "setting": "Zhang 2016 augmented",
    "features": "ImageNet GoogLeNet pool5, 1024-D",
    "sampling": "Uniform 2 fps; exact frame-index rule not reported",
    "segmentation": "KTS; about 5-second intervals; boundary artifact/hash and full settings not reported",
    "shot_aggregation": "Mean frame importance within shot",
    "budget": "15% machine duration; rounding not fully specified in paper",
    "solver": "Shot knapsack in released evaluator; paper supplement uses ranking/knapsack wording",
    "reference_aggregation": "Mean user F1, then mean videos (released evaluator)",
    "metric": "Temporal-overlap F1",
    "value": 57.9,
    "unit": "percent",
    "runs": "5 repeats per setting and testing fold (supplement Section 5.2); fold identities not reported",
    "variance": "Standard deviation 0.5 percentage points",
    "source_url": "https://www.cs.utexas.edu/~grauman/papers/zhang-eccv2016-lstm-summ.pdf",
    "source_location": "Table 3, PDF page 10; protocols Table 2 and supplement Sections 1–3, 5",
    "reproduction": "author-reported",
    "comparability_notes": "No independent rerun. Paper and released dppLSTM decoder differ in description; TVSum evaluator has inherited 0.18 reference-budget discrepancy, so paper scores cannot be declared protocol-identical to later repositories. Protocol evidence: https://www.cs.utexas.edu/~grauman/papers/zhang-eccv2016-lstm-summ-supp.pdf ; https://github.com/kezhang-cs/Video-Summarization-with-LSTM/blob/master/codes/dppLSTM_eval.m",
    "verified_on": "2026-09-08",
    "split_identity": "Not independently verified"
  },
  {
    "id": "vs-lstm-tvsum-transfer",
    "paper_id": "lstm-dpp",
    "method": "vsLSTM",
    "dataset_id": "tvsum",
    "dataset": "TVSum",
    "split": "SumMe + OVP(50) + YouTube(39) training/validation; all TVSum test",
    "training_regime": "Supervised: human importance/summary labels",
    "setting": "Zhang 2016 transfer",
    "features": "ImageNet GoogLeNet pool5, 1024-D",
    "sampling": "Uniform 2 fps; exact frame-index rule not reported",